{
  "relationship_id": "rel_isaac_office_001",
  "source_entity": "char_isaac_001",
  "target_entity": "loc_office_001",
  "relationship_type": "appears_in",
  "strength": 0.85,
  "tags": ["primary_setting", "work_context", "daytime"],
  "metadata": {
    "source": "script_analysis",
    "created_at": "2025-11-07T14:00:00Z",
    "updated_at": "2025-11-07T14:00:00Z",
    "version": "1.0",
    "confidence": 0.92,
    "validation_status": "validated"
  }
}
